[
  {
    "id": 1,
    "name": "Linux Foundation",
    "company": "Linux Foundation",
    "category": "Software",
    "website": "https://www.linuxfoundation.org"
  },
  {
    "id": 2,
    "name": "Nextcloud",
    "company": "Nextcloud GmbH",
    "category": "Software",
    "website": "https://nextcloud.com"
  }
]